ID,TYPE,PARENT,NAME,SOURCE,TARGET,REFERENCE_MODEL_ID,TERM_ID,LABEL,,PROPERTIES:,Description
cd2b7299-d98b-49bd-a1ab-2382b1e30043,Attribute,1fe7f61d-6789-4b86-8f09-b71d284a9139,Outlook,,,,,,,,"What challenges and uncertainties is the organisation likely to encounter in pursuing its strategy, and what are the potential implications for its business model and future performance?"
fca05669-a08a-4e08-8ee0-2194e91a1cb9,Group,1fe7f61d-6789-4b86-8f09-b71d284a9139,Basis of preparation and presentation,,,,,,,,How does the organisation determine what matters to include in the integrated report and how are such matters quantified or evaluated?
0e698bb5-6bf3-46f4-89b1-440fd647a3c6,Attribute,fca05669-a08a-4e08-8ee0-2194e91a1cb9,Summary of materiality determination process,,,,,,,,"An integrated report includes a summary of the organization’s materiality determination process and key judgements. This may include: • Brief description of the process used to identify relevant matters, evaluate their importance and narrow them down to material matters • Identification of the role of those charged with governance and key personnel in the identification and prioritization of material matters A link to where a more detailed description of the materiality determination process can be found may also be included."
ac69c93b-179b-485f-8aeb-f1e3ded79c0d,Attribute,fca05669-a08a-4e08-8ee0-2194e91a1cb9,Reporting boundary,,,,,,,,"An integrated report identifies its reporting boundary and explains how it has been determined. Material risks, opportunities and outcomes attributable to or associated with entities that are included in the financial reporting entity, are reported on in the organization’s integrated report. Risks, opportunities and outcomes attributable to or associated with other entities/stakeholders are reported on in an integrated report to the extent they materially affect the ability of the financial reporting entity to create value. Practical issues might limit the nature and extent of information that can be presented in an integrated report. For example: • The availability of reliable data with respect to entities the financial reporting entity does not control • The inherent inability to identify all risks, opportunities and outcomes that will materially affect the ability of the financial reporting entity to create value, particularly in the long term. It may be appropriate to disclose such limitations, and actions being taken to overcome them, in an integrated report."
d8c3cd64-c6e1-4402-a417-b02a73f4352a,Attribute,fca05669-a08a-4e08-8ee0-2194e91a1cb9,Summary of significant frameworks and methods,,,,,,,,"An integrated report includes a summary of the significant frameworks and methods used to quantify or evaluate material matters included in the report (e.g. the applicable financial reporting standards used for compiling financial information, a company-defined formula for measuring customer satisfaction, or an industry-based framework for evaluating risks). More detailed explanations might be provided in other communications. When information in an integrated report is similar to or based on other information published by the organization, it is prepared on the same basis as, or is easily reconcilable with, that other information. For example, when a key performance indicator covers a similar topic to, or is based on information published in the organization’s financial statements or sustainability report, it is prepared on the same basis, and for the same period, as that other information."