ID,TYPE,PARENT,NAME,SOURCE,TARGET,REFERENCE_MODEL_ID,TERM_ID,LABEL,,PROPERTIES:,Description
82b20597-9f5d-4ec3-8373-ef405451a918,Layer,,International Integrated Reporting Framework (IIRC),,,,,,,,"The International Integrated Reporting Council (IIRC) was a global coalition of regulators, investors, companies, standard setters, the accounting profession, academia and NGOs. Together, this coalition shared the view that communication about value creation, preservation or erosion is the next step in the evolution of corporate reporting. The IIRC developed the International Framework to meet this need and provide a foundation for the future."
330a77c7-d576-41fa-b8f7-6d437bff3028,Object,82b20597-9f5d-4ec3-8373-ef405451a918,The Capitals,,,,,,,,"Stocks of value on which all organisations depend for their success as inputs to their business model, and which are increased, decreased or transformed through the organisation’s business activities and outputs. The capitals are categorized in the IR Framework as financial, manufactured, intellectual, human, social and relationship, and natural."
b335e30b-ffa2-48f3-86b3-b92c052391b8,Attribute,330a77c7-d576-41fa-b8f7-6d437bff3028,Financial capital,,,,,,,,"The pool of funds that is: 
‒ Available to an organisation for use in the production of goods or the provision of services
‒ Obtained through financing, such as debt, equity or grants, or generated through operations or investments."
b3b96568-fbf4-4ff4-a99e-53c053e9723e,Attribute,330a77c7-d576-41fa-b8f7-6d437bff3028,Manufactured capital,,,,,,,,"Manufactured physical objects (as distinct from natural physical objects) that are available to an organisation for use in the production of goods or the provision of services, including: 
‒ Buildings 
‒ Equipment
‒ Infrastructure (such as roads, ports, bridges, and waste and water treatment plants).
Manufactured capital is often created by other organisations, but includes assets manufactured by the reporting organisation for sale or when they are retained for its own use."
61bf263e-4261-4350-b89b-febff4ae6789,Attribute,330a77c7-d576-41fa-b8f7-6d437bff3028,Intellectual capital,,,,,,,,"organisational, knowledge-based intangibles, including:
‒ Intellectual property, such as patents, copyrights, software, rights and licences
‒ “organisational capital” such as tacit knowledge, systems, procedures and protocols."
fa6e4862-7d32-4b76-9cca-f9fd86d963b6,Attribute,330a77c7-d576-41fa-b8f7-6d437bff3028,Human capital,,,,,,,,"People’s competencies, capabilities and experience, and their motivations to innovate, including their:
‒ Alignment with and support for an organisation’s governance framework, risk management approach, and ethical values
‒ Ability to understand, develop and implement an organisation’s strategy
‒ Loyalties and motivations for improving processes, goods and services, including their ability to lead, manage and collaborate."
5bc96f75-b892-49d2-939b-088acf7541d5,Attribute,330a77c7-d576-41fa-b8f7-6d437bff3028,Social and relationship capital,,,,,,,,"The institutions and the relationships within and between communities, groups of stakeholders and other networks, and the ability to share information to enhance individual and collective well-being. 
Social and relationship capital includes:
‒ Shared norms, and common values and behaviours
‒ Key stakeholder relationships, and the trust and willingness to engage that an organisation has developed and strives to build and protect with external stakeholders
‒ Intangibles associated with the brand and reputation that an organisation has developed
‒ An organisation’s social licence to operate."
bb537aad-6a65-43bf-9b5c-a0ebf39ac7f3,Attribute,330a77c7-d576-41fa-b8f7-6d437bff3028,Natural capital,,,,,,,,"All renewable and non-renewable environmental resources and processes that provide goods or services that support the past, current or future prosperity of an organisation. It includes:
‒ Air, water, land, minerals and forests
‒ Biodiversity and eco-system health."
d106e9a4-0382-41ce-9d4d-43229a9357ee,Object,82b20597-9f5d-4ec3-8373-ef405451a918,Guiding Principles,,,,,,,,"These underpin the prep and presentation of an IR, informing the content of the report and how information is presented"
77427215-e369-421a-a5cd-db8c1d03aa26,Attribute,d106e9a4-0382-41ce-9d4d-43229a9357ee,Strategic focus and future orientation,,,,,,,,"An integrated report should provide insight into the organisation's strategy, and how it relates to the organisation's ability to create value in the short, medium and long term, and to its use of and effects on the capitals."
d669cf7f-0e42-4234-ab7c-88e7d80fab69,Group,d106e9a4-0382-41ce-9d4d-43229a9357ee,Connectivity of information,,,,,,,,"An integrated report should show a holistic picture of the combination, interrelatedness and dependencies between the factors that affect the organisation’s ability to create value over time"
3ee1cc92-8b93-442c-a438-0acc7ce46b41,Attribute,d669cf7f-0e42-4234-ab7c-88e7d80fab69,The Content Elements,,,,,,,,"The integrated report connects the Content Elements into a total picture that reflects the dynamic and systemic interactions of the organisation’s activities as a whole. For example:
‒ An analysis of existing resource allocation, and how the organisation will combine resources or make further investment to achieve its targeted performance"
0996f59f-9ca1-44fa-8de8-60a5da8bc211,Attribute,d669cf7f-0e42-4234-ab7c-88e7d80fab69,"The past, present and future",,,,,,,,An analysis by the organisation of its activities in the past-to-present period can provide useful information to assess the plausibility of what has been reported concerning the present-to-future period. The explanation of the past-to-present period can also be useful in analyzing current capabilities and the quality of management.
61662bfd-044f-4e3b-adb3-5bd31072a150,Attribute,d669cf7f-0e42-4234-ab7c-88e7d80fab69,The capitals,,,,,,,,"This includes the interdependencies and trade-offs between the capitals, and how changes in their availability, quality and affordability affect the ability of the organisation to create value."
5a8a2611-3ec3-4399-a7d2-8049a60347ee,Attribute,d669cf7f-0e42-4234-ab7c-88e7d80fab69,Financial and other information,,,,,,,,"For example, the implications for: 
‒ Expected revenue growth or market share of research and development policies, technology/know-how or investment in human resources
‒ Cost reduction or new business opportunities of environmental policies, energy efficiency, cooperation with local communities or technologies to tackle social issues
‒ Revenue and profit growth of long-term customer relationships, customer satisfaction or reputation."
5835f2b7-95f6-4fca-a578-8ad54796ea43,Attribute,d669cf7f-0e42-4234-ab7c-88e7d80fab69,Quantitative and qualitative information,,,,,,,,Both qualitative and quantitative information are necessary for an integrated report to properly represent the organisation’s ability to create value as each provides context for the other. Including key performance indicators as part of a narrative explanation can be an effective way to connect quantitative and qualitative information.
4195b265-8129-4407-9fc7-9e5608eccb6f,Attribute,d669cf7f-0e42-4234-ab7c-88e7d80fab69,"Management information, board information and information reported externally",,,,,,,,"For example, it is important for the quantitative indicators in an integrated report to be consistent with the indicators used internally by management and those charged with governance."
5ec5ec56-af11-427b-ba3f-95cb22291b18,Attribute,d669cf7f-0e42-4234-ab7c-88e7d80fab69,"Information in the integrated report, information in the organisation’s other communications, and information from other sources",,,,,,,,"This recognises that all communications from the organisation need to be consistent, and that information the organisation provides is not read in isolation but combined with information from other sources when making assessments."
e17d80ae-5aef-4c9d-af0b-e8500a528e76,Attribute,d106e9a4-0382-41ce-9d4d-43229a9357ee,Stakeholder relationships,,,,,,,,"An integrated report should provide insight into the nature and quality of the organization’s relationships with its key stakeholders, including how and to what extent the organization understands, takes into account and responds to their legitimate needs and interests."
4ca4cb8e-da2d-4d14-b77b-c6c4f706ecbb,Group,d106e9a4-0382-41ce-9d4d-43229a9357ee,Materiality,,,,,,,,"An integrated report should disclose information about matters that substantively affect the organisation’s ability to create value over the short, medium and long term"
296aeff0-a552-42fc-8ead-c45a70d46002,Attribute,4ca4cb8e-da2d-4d14-b77b-c6c4f706ecbb,The materiality determination process,,,,,,,,"The materiality determination process for the purpose of preparing and presenting an integrated report involves: 
• Identifying relevant matters based on their ability to affect value creation
• Evaluating the importance of relevant matters in terms of their known or potential effect on value creation
• Prioritizing the matters based on their relative importance 
• Determining the information to disclose about material matters."
416762fa-d4af-42db-8e0a-d6ad38adf2c1,Attribute,4ca4cb8e-da2d-4d14-b77b-c6c4f706ecbb,Identifying relevant matters,,,,,,,,"Relevant matters are those that have, or may have, an effect on the organisation’s ability to create value. This is determined by considering their effect on the organisation’s strategy, governance, performance or prospects."
c5a14fcc-1b14-47cf-b395-fae5f90eb974,Attribute,4ca4cb8e-da2d-4d14-b77b-c6c4f706ecbb,Evaluating importance,,,,,,,,"Not all relevant matters will be considered material. To be included in an integrated report, a matter also needs to be sufficiently important in terms of its known or potential effect on value creation. This involves evaluating the magnitude of the matter’s effect and, if it is uncertain whether the matter will occur, its likelihood of occurrence."
cc3ea214-9d33-49e0-bef7-5c1b52c041e2,Attribute,4ca4cb8e-da2d-4d14-b77b-c6c4f706ecbb,Prioritising important matters,,,,,,,,"Once the population of important matters is identified, they are prioritised based on their magnitude. This helps to focus on the most important matters when determining how they are reported."
a9e2e053-dd49-437d-8a76-caefccb60bea,Attribute,4ca4cb8e-da2d-4d14-b77b-c6c4f706ecbb,Determining information to disclose,,,,,,,,"Judgement is applied in determining the information to disclose about material matters. This requires consideration from different perspectives, both internal and external, and is assisted by regular engagement with providers of financial capital and others to ensure the integrated report meets its primary purpose."
3efa7be5-b428-4ce5-83b8-421cdc0ca04b,Attribute,4ca4cb8e-da2d-4d14-b77b-c6c4f706ecbb,Reporting boundary,,,,,,,,"Key to the materiality determination process is the concept of the reporting boundary. Determining the boundary for an integrated report has two aspects: 
• The financial reporting entity (i.e. the boundary used for financial reporting purposes)
• Risks, opportunities and outcomes attributable to or associated with other entities/stakeholders beyond the financial reporting entity that have a significant effect on the ability of the financial reporting entity to create value.
The financial reporting entity is central to the reporting boundary because: 
• It is the financial reporting entity in which providers of financial capital invest and therefore need information about
• Using the financial reporting entity enables the information in the financial statements to serve as an anchor or point of reference to which the other information in an integrated report can be related."
01067113-0223-400f-abd0-94f710627b0e,Attribute,4ca4cb8e-da2d-4d14-b77b-c6c4f706ecbb,Financial reporting entity,,,,,,,,"The financial reporting entity identifies which subsidiaries’, joint ventures’ and associates’ transactions and related events are included in the organisation’s financial report. The financial reporting entity is determined according to applicable financial reporting standards which revolve around the concepts of control or significant influence."
a34e5c73-1a7d-4b43-8b37-44025ffebd16,Attribute,4ca4cb8e-da2d-4d14-b77b-c6c4f706ecbb,"Risks, opportunities and outcomes",,,,,,,,"The second aspect of determining the reporting boundary is to identify those risks, opportunities and outcomes attributable to or associated with entities/stakeholders beyond the financial reporting entity that have a significant effect on the ability of the financial reporting entity to create value. These other entities/stakeholders might be “related parties” for the purpose of financial reporting, but will ordinarily extend further."
9bc6b0f5-d365-486e-81b4-8ed09b0c8e12,Attribute,d106e9a4-0382-41ce-9d4d-43229a9357ee,Conciseness,,,,,,,,"An integrated report should be concise. An integrated report includes sufficient context to understand the organisation’s strategy, governance, performance and prospects without being burdened with less relevant information."
e44637bb-42b3-49d4-8fbb-cf46fee8b260,Group,d106e9a4-0382-41ce-9d4d-43229a9357ee,Reliability and completeness,,,,,,,,"An integrated report should include all material matters, both positive and negative, in a balanced way and without material error"
dc79c84a-157f-4072-a8b0-990b1d705b59,Attribute,e44637bb-42b3-49d4-8fbb-cf46fee8b260,Reliability,,,,,,,,"The reliability of information is affected by its balance and freedom from material error. Reliability (which is often referred to as faithful representation) is enhanced by mechanisms such as robust internal control and reporting systems, stakeholder engagement, internal audit or similar functions, and independent, external assurance."
12413fc0-f80e-42fe-a423-c1f27d6e8f0d,Attribute,e44637bb-42b3-49d4-8fbb-cf46fee8b260,Balance,,,,,,,,"A balanced integrated report has no bias in the selection or presentation of information. Information in the report is not slanted, weighted, emphasized, de-emphasized, combined, offset or otherwise manipulated to change the probability that it will be received either favourably or unfavourably. Important methods to ensure balance include: 
• Selection of presentation formats that are not likely to unduly or inappropriately influence assessments made on the basis of the integrated report
• Giving equal consideration to both increases and decreases in the capitals, both strengths and weaknesses of the organisation, both positive and negative performance, etc.
• Reporting against previously reported targets, forecasts, projections and expectations."
d3e112f1-3b3a-4f1f-b22b-6a9ff06f3688,Attribute,e44637bb-42b3-49d4-8fbb-cf46fee8b260,Freedom from material error,,,,,,,,"Freedom from material error does not imply that the information is perfectly accurate in all respects. It does imply that: 
• Processes and controls have been applied to reduce to an acceptably low level the risk that reported information contains a material misstatement
• When information includes estimates, this is clearly communicated, and the nature and limitations of the estimation process are explained."
dbf94a51-23fa-4f2d-8dfc-a85579454f5f,Attribute,e44637bb-42b3-49d4-8fbb-cf46fee8b260,Completeness,,,,,,,,"A complete integrated report includes all material information, both positive and negative. To help ensure that all material information has been identified, consideration is given to what organisations in the same industry are reporting on because certain matters within an industry are likely to be material to all organisations in that industry.  Determining completeness includes considering the extent of information disclosed and its level of specificity or preciseness. This might involve considering potential concerns regarding cost/benefit, competitive advantage and future-oriented information."
b85f8a73-03f9-41f7-a7b5-c3ea531897c0,Attribute,e44637bb-42b3-49d4-8fbb-cf46fee8b260,Cost/benefit,,,,,,,,"Information included in an integrated report is, by nature, central to managing the business. Accordingly, if a matter is important to managing the business, cost should not be a factor in failing to obtain critical information to appropriately assess and manage the matter. An organisation may evaluate cost and benefits when determining the extent, level of specificity, and preciseness of information necessary for an integrated report to meet its primary purpose, but may not refrain entirely from making any disclosure about a material matter on the basis of cost."
891ab86a-088c-4829-9d33-e5978daa3484,Attribute,e44637bb-42b3-49d4-8fbb-cf46fee8b260,Competitive advantage,,,,,,,,"In including information about material matters dealing with competitive advantage (e.g. critical strategies), an organisation considers how to describe the essence of the matter without identifying specific information that might cause a significant loss of competitive advantage. Accordingly, the organisation considers what advantage a competitor could actually gain from information in an integrated report, and balances this against the need for the integrated report to achieve its primary purpose."
d3e1afdf-24ab-4c53-9848-51cf0346cd32,Attribute,e44637bb-42b3-49d4-8fbb-cf46fee8b260,Future-oriented information,,,,,,,,"Legal or regulatory requirements may apply to certain future-oriented information in some jurisdictions, covering for example: 
• The types of disclosures that may be made
• Whether cautionary statements may be required or permitted to highlight uncertainty regarding achievability
• An obligation to publicly update such information. 
Future-oriented information is by nature more uncertain than historical information. Uncertainty is not, however, a reason in itself to exclude such information."
f37987ec-1e32-48a2-84bf-b1aa991caa12,Group,d106e9a4-0382-41ce-9d4d-43229a9357ee,Consistency and comparability,,,,,,,,The information in an integrated report should be presented: (a) on a basis that is consistent over time; and (b) in a way that enables comparison with other organisations to the extent it is material to the organisation’s own ability to create value over time.
339cd798-9911-4edc-b56e-f629a771c72d,Attribute,f37987ec-1e32-48a2-84bf-b1aa991caa12,Consistency,,,,,,,,"Reporting policies are followed consistently from one period to the next unless a change is needed to improve the quality of information reported. This includes reporting the same key performance indicators if they continue to be material across reporting periods. When a significant change has been made, the organisation explains the reason for the change, describing (and quantifying if practicable and material) its effect."
53a0449b-5c23-4299-b797-86c02a6c6616,Attribute,f37987ec-1e32-48a2-84bf-b1aa991caa12,Comparability,,,,,,,,"The specific information in an integrated report will, necessarily, vary from one organisation to another because each organisation creates value in its own unique way. Nonetheless, addressing the questions relating to the Content Elements, which apply to all organisations, helps ensure a suitable level of comparability between organisations. Other powerful tools for enhancing comparability (in both an integrated report itself and any detailed information that it links to) can include: • Using benchmark data, such as industry or regional benchmarks • Presenting information in the form of ratios (e.g. research expenditure as a percentage of sales, or carbon intensity measures such as emissions per unit of output) • Reporting quantitative indicators commonly used by other organisations with similar activities, particularly when standardized definitions are stipulated by an independent organisation (e.g. an industry body). Such indicators are not, however, included in an integrated report unless they are relevant to the individual circumstances of, and are used internally by, the organisation"
1fe7f61d-6789-4b86-8f09-b71d284a9139,Object,82b20597-9f5d-4ec3-8373-ef405451a918,Content Elements,,,,,,,,An IR report includes these elements that are fundamentally linked to each other and are not mutually exclusive
4f0367c2-6d4e-4856-b7d0-bbf8e1470188,Group,1fe7f61d-6789-4b86-8f09-b71d284a9139,Organisational overview and external environment,,,,,,,,What does the organisation do and what are the circumstances under which it operates?
cbeb14f7-b73f-4a19-8a9c-53bb4b821ec1,Attribute,4f0367c2-6d4e-4856-b7d0-bbf8e1470188,External environment,,,,,,,,"Significant factors affecting the external environment include aspects of the legal, commercial, social, environmental and political context that affect the organization’s ability to create value in the short, medium or long term. They can affect the organization directly or indirectly (e.g. by influencing the availability, quality and affordability of a capital that the organization uses or affects). These factors occur in the context of the particular organization, in the context of its industry or region, and in the wider social or planetary context. They may include, for example: • The legitimate needs and interests of key stakeholders • Macro and micro economic conditions, such as economic stability, globalization, and industry trends • Market forces, such as the relative strengths and weaknesses of competitors and customer demand • The speed and effect of technological change • Societal issues, such as population and demographic changes, human rights, health, poverty, collective values and educational systems • Environmental challenges, such as climate change, the loss of ecosystems, and resource shortages as planetary limits are approached • The legislative and regulatory environment in which the organization operates • The political environment in countries where the organization operates and other countries that may affect the ability of the organization to implement its strategy"
23f3e2d4-ce2b-4dd1-92e9-950811a3f9c0,Attribute,1fe7f61d-6789-4b86-8f09-b71d284a9139,Governance,,,,,,,,"How does the organisation's governance structure support its ability to create value in the short, medium and long term?"
732af1b7-9b6d-47d7-a94d-1a493efd8ae2,Group,1fe7f61d-6789-4b86-8f09-b71d284a9139,Business model,,,,,,,,What is the organisation's business model?
a1623620-d1b6-40f7-ba48-eb82b3bf9837,Attribute,732af1b7-9b6d-47d7-a94d-1a493efd8ae2,Inputs,,,,,,,,"An integrated report shows how key inputs relate to the capitals on which the organization depends, or that provide a source of differentiation for the organization, to the extent they are material to understanding the robustness and resilience of the business model. An integrated report does not attempt to provide an exhaustive list of all inputs. Rather, the focus is on those that have a material bearing on the ability to create value in the short, medium and long term, whether or not the capitals from which they are derived are owned by the organization. It may also include a discussion of the nature and magnitude of the significant trade-offs that influence the selection of inputs."
7dd88089-0f1f-4de0-a4e8-81b0cb643884,Attribute,732af1b7-9b6d-47d7-a94d-1a493efd8ae2,Business activities,,,,,,,,"An integrated report describes key business activities. This can include: • How the organization differentiates itself in the market place (e.g. through product differentiation, market segmentation, delivery channels and marketing) • The extent to which the business model relies on revenue generation after the initial point of sale (e.g. extended warranty arrangements or network usage charges) • How the organization approaches the need to innovate • How the business model has been designed to adapt to change."
d8f3c608-6847-4e30-ae76-8456bffe3937,Attribute,732af1b7-9b6d-47d7-a94d-1a493efd8ae2,Outputs,,,,,,,,"An integrated report identifies an organization’s key products and services. There might be other outputs, such as by-products and waste (including emissions), that need to be discussed within the business model disclosure depending on their materiality."
28c36a0b-51b1-4f68-9c9c-55da6aab29fb,Attribute,732af1b7-9b6d-47d7-a94d-1a493efd8ae2,Outcomes,,,,,,,,"An integrated report describes key outcomes. Outcomes are the internal and external consequences (positive and negative) for the capitals as a result of an organization’s business activities and outputs. The description of outcomes includes: • Both internal outcomes (e.g. employee morale, organizational reputation, revenue and cash flows) and external outcomes (e.g. customer satisfaction, tax payments, brand loyalty, and social and environmental effects) • Both positive outcomes (i.e. those that result in a net increase in the capitals and thereby create value) and negative outcomes (i.e. those that result in a net decrease in the capitals and thereby erode value)."
782bf87b-0001-4920-b5fd-7d6939f07cdc,Attribute,1fe7f61d-6789-4b86-8f09-b71d284a9139,Risks and opportunities,,,,,,,,"What are the specific risks and opportunities that affect the organisation's ability to create value over the short, medium and long term, and how is the organisation dealing with them?"
6390d566-5b38-40d9-a01f-cd72fe650a7e,Attribute,1fe7f61d-6789-4b86-8f09-b71d284a9139,Strategy and resource allocation,,,,,,,,Where does the organisation want to go and how does it intend to go there?
c7ebdd7c-e422-4cd1-9b2e-f4c46422c86c,Attribute,1fe7f61d-6789-4b86-8f09-b71d284a9139,Performance,,,,,,,,To what extent has the organisation achieved its strategic objectives for the period and what are its outcomes in terms of effects on the capitals?
