ID,TYPE,PARENT,NAME,SOURCE,TARGET,REFERENCE_MODEL_ID,TERM_ID,LABEL,,PROPERTIES:,Quant_Qual,Title,Guidance,Delta,Full/Partial Match,Principle,Disclosure
359560f8-36dd-4174-a248-c86d428a532f,Layer,,TCFD,,,,,,,,,,,,,,
0b403aea-90ae-4d19-a968-41d22914f491,Object,359560f8-36dd-4174-a248-c86d428a532f,Governance,,,,,,,,,,,,,,
1e85d99c-26d9-464f-9fba-058d5681fd4b,Attribute,0b403aea-90ae-4d19-a968-41d22914f491,Recommended Disclosure a),,,,,,,,Qualitative,Describe the board’s oversight of climate-related risks and opportunities.,"In describing the board’s oversight of climate-related issues, organizations should consider including a discussion of the following: ‒ processes and frequency by which the board and/or board committees (e.g., audit, risk, or other committees) are informed about climate-related issues; ‒ whether the board and/or board committees consider climate-related issues when reviewing and guiding strategy, major plans of action, risk management policies, annual budgets, and business plans as well as setting the organization’s performance objectives, monitoring implementation and performance, and overseeing major capital expenditures, acquisitions, and divestitures; and ‒ how the board monitors and oversees progress against goals and targets for addressing climate-related issues.",,,,
5af49c2c-3ff5-4628-be10-4360013c40b7,Attribute,0b403aea-90ae-4d19-a968-41d22914f491,Recommended Disclosure b),,"8030962b-ec64-4eff-9ae9-cb9c8893b8cd,b3ef5c78-71cf-424d-ba9f-a71ae94afe6b",,,,,,Qualitative,Describe management’s role in assessing and managing climate-related risks and opportunities.,"In describing management’s role related to the assessment and management of climate-related issues, organizations should consider including the following information: ‒ whether the organization has assigned climate-related responsibilities to management-level positions or committees; and, if so, whether such management positions or committees report to the board or a committee of the board and whether those responsibilities include assessing and/or managing climate-related issues; ‒ a description of the associated organizational structure(s); ‒ processes by which management is informed about climate-related issues; and ‒ how management (through specific positions and/or management committees) monitors climate-related issues.",,,,
f27df117-b111-4290-9bdc-46eae135271c,Transition,,,5af49c2c-3ff5-4628-be10-4360013c40b7,8030962b-ec64-4eff-9ae9-cb9c8893b8cd,,,,,,,,,TCFD does not take into account managements compensation. TCFD focus on the granular level in which they focus on managements process towards climate related issues,Partial,,
efc75e16-c6a2-4e8f-bb18-cdea6dd088a6,Transition,,,5af49c2c-3ff5-4628-be10-4360013c40b7,b3ef5c78-71cf-424d-ba9f-a71ae94afe6b,,,,,,,,,OSFI takes into Risk Appetite Framework and Enterprise Risk Management but the similarities involve in the management processes involved and the adaptions to it,Partial,,
9c653d24-d1c4-4157-90a8-5ef4d4784a38,Object,359560f8-36dd-4174-a248-c86d428a532f,Strategy,,,,,,,,,,,,,,
33f6c0ba-12b3-4415-80b2-3a6feed08ed0,Group,9c653d24-d1c4-4157-90a8-5ef4d4784a38,Recommended Disclosure a),,8c814ddd-975c-40f5-af08-d46ec8d849cc,,,,,,Qualitative,"Describe the climate-related risks and opportunities the organization has identified over the short, medium, and long term.","Organizations should provide the following information: ‒ a description of what they consider to be the relevant short-, medium-, and longterm horizons, taking into consideration the useful life of the organization’s assets or infrastructure and the fact that climate-related issues often manifest themselves over the medium and longer terms; ‒ a description of the specific climate-related issues potentially arising in each time horizon (short, medium, and long term) that could have a material financial impact on the organization; and ‒ a description of the process(es) used to determine which risks and opportunities could have a material financial impact on the organization. Organizations should consider providing a description of their risks and opportunities by sector and/or geography, as appropriate. In describing climate-related issues, organizations should refer to Tables A1.1 and A1.2 (pp. 75–76).",,,,
16361eca-9803-4006-856a-0bda03c333d2,Transition,,,33f6c0ba-12b3-4415-80b2-3a6feed08ed0,8c814ddd-975c-40f5-af08-d46ec8d849cc,,,,,,,,,"TCFD description of what they consider to be the relevant short-, medium-, and longterm horizons, taking into consideration the useful life of the organization’s assets or infrastructure and the fact that climate-related issues often manifest themselves over the medium and longer terms. FRFI should use results as an input into its capital and financial planning processes. The difference being FRFI include scress testing on scenario analysis when inputting issues",,,
52d71f8b-955c-4c4a-bedb-fd23e60429bb,Attribute,33f6c0ba-12b3-4415-80b2-3a6feed08ed0,Supplemental Guidance for Banks,,,,,,,,Quantitative,Supplemental Guidance for Banks,"Banks should describe significant concentrations of credit exposure to carbon-related assets. Additionally, banks should consider disclosing their climate-related risks (transition and physical) in their lending and other financial intermediary business activities.",,,,
743e65b8-3187-4b93-99af-7c9989148a9c,Group,9c653d24-d1c4-4157-90a8-5ef4d4784a38,Recommended Disclosure b),,f33646aa-12ec-4cab-88d0-cd1e8afa5b4a,,,,,,Qualitative,"Describe the impact of climate-related risks and opportunities on the organization’s businesses, strategy, and financial planning.","Building on recommended disclosure (a), organizations should discuss how identified climate-related issues have affected their businesses, strategy, and financial planning. Organizations should consider including the impact on their businesses, strategy, and financial planning in the following areas: ‒ Products and services ‒ Supply chain and/or value chain ‒ Adaptation and mitigation activities ‒ Investment in research and development ‒ Operations (including types of operations and location of facilities) ‒ Acquisitions or divestments ‒ Access to capital Organizations should describe how climate related issues serve as an input to their financial planning process, the time period(s) used, and how these risks and opportunities are prioritized. Organizations’ disclosures should reflect a holistic picture of the interdependencies among the factors that affect their ability to create value over time. Organizations should describe the impact of climate-related issues on their financial performance (e.g., revenues, costs) and financial position (e.g., assets, liabilities). If climate-related scenarios were used to inform the organization’s strategy and financial planning, such scenarios should be described. Organizations that have made GHG emissions reduction commitments, operate in jurisdictions that have made such commitments, or have agreed to meet investor expectations regarding GHG emissions reductions should describe their plans for transitioning to a low-carbon economy, which could include GHG emissions targets and specific activities intended to reduce GHG emissions in their operations and value chain or to otherwise support the transition.",,,,
1f50c35c-060f-49a1-ac47-6152964cb79a,Transition,,,743e65b8-3187-4b93-99af-7c9989148a9c,f33646aa-12ec-4cab-88d0-cd1e8afa5b4a,,,,,,,,,"Management take into account the strategies and implementation processes involved in strategic financial planning and short, medium and long term process",Full,,
c079602b-8cca-4b4e-8aa0-279bb0e579a7,Attribute,743e65b8-3187-4b93-99af-7c9989148a9c,Supplemental Guidance for Insurance Companies,,,,,,,,Qualitative,Supplemental Guidance for Insurance Companies,"Insurance companies should describe the potential impacts of climate-related risks and opportunities as well as provide supporting quantitative information where available, on their core businesses, products, and services, including: ‒ information at the business division, sector, or geography levels; ‒ how the potential impacts influence client or broker selection; and ‒ whether specific climate-related products or competencies are under development, such as insurance of green infrastructure, specialty climate-related risk advisory services, and climate-related client engagement.",,,,
e92d54d6-1cf3-4db1-a4b1-f98a0d3cddcc,Attribute,743e65b8-3187-4b93-99af-7c9989148a9c,Supplemental Guidance for Asset Owners,,,,,,,,Qualitative,Supplemental Guidance for Asset Owners,Asset owners should describe how climate-related risks and opportunities are factored into relevant investment strategies. This could be described from the perspective of the total fund or investment strategy or individual investment strategies for various asset classes.,,,,
a769271a-febb-48be-9d49-7ab631819550,Attribute,743e65b8-3187-4b93-99af-7c9989148a9c,Supplemental Guidance for Asset Managers,,,,,,,,Qualitative,Supplemental Guidance for Asset Managers,Asset managers should describe how climate-related risks and opportunities are factored into relevant products or investment strategies. Asset managers should also describe how each product or investment strategy might be affected by the transition to a low-carbon economy.,,,,
36058f69-8afa-4f8e-9e23-fc02cd6805e9,Group,9c653d24-d1c4-4157-90a8-5ef4d4784a38,Recommended Disclosure c),,"a3167375-ad4c-4dab-8f21-957739c3384e,4f3c19d9-e4d2-45e0-b35a-03b41e2939e5,37de5e40-6312-40ff-963c-e636e9914463",,,,,,Qualitative,"Describe the resilience of the organization’s strategy, taking into consideration different climate-related scenarios, including a 2°C or lower scenario.","Organizations should describe how resilient their strategies are to climate-related risks and opportunities, taking into consideration a transition to a low-carbon economy consistent with a 2°C or lower scenario and, where relevant to the organization, scenarios consistent with increased physical climate-related risks. Organizations should consider discussing: ‒ where they believe their strategies may be affected by climate-related risks and opportunities; ‒ how their strategies might change to address such potential risks and opportunities; ‒ the potential impact of climate-related issues on financial performance (e.g., revenues, costs) and financial position (e.g., assets, liabilities); and ‒ the climate-related scenarios and associated time horizon(s) considered. Refer to Section D in the Task Force’s report for information on applying scenarios to forward-looking analysis.",,,,
e9904352-37f2-4cd0-88e4-25f7131c2014,Transition,,,36058f69-8afa-4f8e-9e23-fc02cd6805e9,a3167375-ad4c-4dab-8f21-957739c3384e,,,,,,,,,Both regimes take into account their processes for a transition plan towards net zero Carbon economy (< 2C) however OSFI focuses specifically on the Climate Transition Plan,Full,,
204d82cf-b468-4427-8c9c-05ccdd3ada11,Transition,,,36058f69-8afa-4f8e-9e23-fc02cd6805e9,4f3c19d9-e4d2-45e0-b35a-03b41e2939e5,,,,,,,,,"Organizations should describe how resilient their strategies are to climate-related risks and opportunities, taking into consideration a transition to a low-carbon economy consistent with a 2°C or lower scenario and, where relevant to the organization, scenarios consistent with increased physical climate-related risks. The FRFI should consider scenarios that encompass both physical and transition risks, and the potential interplay between these two types of risks. The difference again being the methodology and data collection processes",Partial,,
9cde2042-5ac0-4c03-a74b-c7a330caa2ff,Transition,,,36058f69-8afa-4f8e-9e23-fc02cd6805e9,37de5e40-6312-40ff-963c-e636e9914463,,,,,,,,,"Organizations should describe how resilient their strategies are to climate-related risks and opportunities, taking into consideration a transition to a low-carbon economy consistent with a 2°C or lower scenario and, where relevant to the organization, scenarios consistent with increased physical climate-related risks. The FRFI should consider scenarios that encompass both physical and transition risks, and the potential interplay between these two types of risks. The difference again being the methodology and data collection processes",Partial,,
be6bc5ff-173e-4b7a-bd01-0ffeb9ba47b1,Attribute,36058f69-8afa-4f8e-9e23-fc02cd6805e9,Supplemental Guidance for Insurance Companies,,,,,,,,Qualitative,Supplemental Guidance for Insurance Companies,"Insurance companies that perform climate-related scenario analysis on their underwriting activities should provide the following information: ‒ description of the climate-related scenarios used, including the critical input parameters, assumptions and considerations, and analytical choices. In addition to a 2°C scenario, insurance companies with substantial exposure to weather-related perils should consider using a greater than 2°C scenario to account for physical effects of climate change and ‒ time frames used for the climate-related scenarios, including short-, medium-, and long-term milestones.",,,,
b9beb23c-699f-4131-b311-3d419f1bd4e2,Attribute,36058f69-8afa-4f8e-9e23-fc02cd6805e9,Supplemental Guidance for Asset Owners,,,,,,,,Qualitative,Supplemental Guidance for Asset Owners,"Asset owners that perform scenario analysis should consider providing a discussion of how climate-related scenarios are used, such as to inform investments in specific assets.",,,,
8941c8a9-38f4-4bb6-a867-efd3623629c3,Object,359560f8-36dd-4174-a248-c86d428a532f,Risk Management,,,,,,,,,,,,,,
13b6f3bf-579e-458d-89ee-dd3af6133e2c,Group,8941c8a9-38f4-4bb6-a867-efd3623629c3,Recommended Disclosure a),,e0d3f10a-5cf2-4014-b45d-9bd346217614,,,,,,Qualitative,Describe the organization’s processes for identifying and assessing climate-related risks.,"Organizations should describe their risk management processes for identifying and assessing climate-related risks. An important aspect of this description is how organizations determine the relative significance of climate-related risks in relation to other risks. Organizations should describe whether they consider existing and emerging regulatory requirements related to climate change (e.g., limits on emissions) as well as other relevant factors considered. Organizations should also consider disclosing the following: ‒ processes for assessing the potential size and scope of identified climate-related risks and ‒ definitions of risk terminology used or references to existing risk classification frameworks used.",,,,
92d80a7d-5e71-4f99-a24b-146d9575c7a4,Transition,,,13b6f3bf-579e-458d-89ee-dd3af6133e2c,e0d3f10a-5cf2-4014-b45d-9bd346217614,,,,,,,,,"OSFI  takes into account portfolio exposures when looking at climate risks such as market risk, credit risk etc. TCFD describe their risk management processes for identifying and assessing climate-related risks. An important aspect of this description is how organizations determine the relative significance of climate-related risks in relation to other risks",Partial,,
6407556e-5921-4315-b5ba-1b005d1fe89e,Attribute,13b6f3bf-579e-458d-89ee-dd3af6133e2c,Supplemental Guidance for Banks,,,,,,,,Qualitative,Supplemental Guidance for Banks,"Banks should consider characterizing their climate-related risks in the context of traditional banking industry risk categories such as credit risk, market risk, liquidity risk, and operational risk.",,,,
8a1651e5-2488-4d91-999e-a36bb7f68305,Attribute,13b6f3bf-579e-458d-89ee-dd3af6133e2c,Supplemental Guidance for Insurance Companies,,,,,,,,Qualitative,Supplemental Guidance for Insurance Companies,"Insurance companies should describe the processes for identifying and assessing climate-related risks on re-/insurance portfolios by geography, business division, or product segments, including the following risks: ‒ physical risks from changing frequencies and intensities of weather-related perils; ‒ transition risks resulting from a reduction in insurable interest due to a decline in value, changing energy costs, or implementation of carbon regulation; and ‒ liability risks that could intensify due to a possible increase in litigation.",,,,
84a69cdb-a77f-421d-a2c3-7b660f169ef8,Attribute,13b6f3bf-579e-458d-89ee-dd3af6133e2c,Supplemental Guidance for Asset Owners,,,,,,,,Qualitative,Supplemental Guidance for Asset Owners,"Asset owners should describe, where appropriate, engagement activity with investee companies to encourage better disclosure and practices related to climate-related risks to improve data availability and asset owners’ ability to assess climate-related risks.",,,,
04d63666-92c0-4ec4-91e1-adf9f287f3a8,Attribute,13b6f3bf-579e-458d-89ee-dd3af6133e2c,Supplemental Guidance for Asset Managers,,,,,,,,Qualitative,Supplemental Guidance for Asset Managers,"Asset managers should describe, where appropriate, engagement activity with investee companies to encourage better disclosure and practices related to climate-related risks in order to improve data availability and asset managers’ ability to assess climate-related risks. Asset managers should also describe how they identify and assess material climate-related risks for each product or investment strategy. This might include a description of the resources and tools used in the process.",,,,
f44d4ab3-359c-44ed-adae-8449c3d80295,Group,8941c8a9-38f4-4bb6-a867-efd3623629c3,Recommended Disclosure b),,9ece8f3e-d669-4bd5-8214-98b3d092cb49,,,,,,Qualitative,Describe the organization’s processes for managing climate-related risks.,"Organizations should describe their processes for managing climate-related risks, including how they make decisions to mitigate, transfer, accept, or control those risks. In addition, organizations should describe their processes for prioritizing climate-related risks, including how materiality determinations are made within their organizations. In describing their processes for managing climate-related risks, organizations should address the risks included in Tables A1.1 and A1.2 (pp. 75–76), as appropriate.",,,,
11db85ab-cb49-4dea-8431-62d3a476772c,Transition,,,f44d4ab3-359c-44ed-adae-8449c3d80295,9ece8f3e-d669-4bd5-8214-98b3d092cb49,,,,,,,,,Both regimes focus on the management process in identifying risks,Full,,
daadb7f6-7fd6-4059-bb14-7cfb8845d324,Attribute,f44d4ab3-359c-44ed-adae-8449c3d80295,Supplemental Guidance for Insurance Companies,,,,,,,,Qualitative,Supplemental Guidance for Insurance Companies,"Insurance companies should describe key tools or instruments, such as risk models, used to manage climate-related risks in relation to product development and pricing. Insurance companies should also describe the range of climate-related events considered and how the risks generated by the rising propensity and severity of such events are managed.",,,,
1f6e1274-60e3-44eb-b33d-9f50728c44f7,Attribute,f44d4ab3-359c-44ed-adae-8449c3d80295,Supplemental Guidance for Asset Owners,,,,,,,,Qualitative,Supplemental Guidance for Asset Owners,"Asset owners should describe how they consider the positioning of their total portfolio with respect to the transition to a low-carbon energy supply, production, and use. This could include explaining how asset owners actively manage their portfolios’ positioning in relation to this transition.",,,,
21881087-3bd0-4e64-8506-9983b98424fb,Attribute,f44d4ab3-359c-44ed-adae-8449c3d80295,Supplemental Guidance for Asset Managers,,,,,,,,Qualitative,Supplemental Guidance for Asset Managers,Asset managers should describe how they manage material climate-related risks for each product or investment strategy.,,,,
d9ddea06-96b2-4efb-b2d5-899230c5ee10,Attribute,8941c8a9-38f4-4bb6-a867-efd3623629c3,Recommended Disclosure c),,9ece8f3e-d669-4bd5-8214-98b3d092cb49,,,,,,Qualitative,"Describe how processes for identifying, assessing, and managing climate-related risks are integrated into the organization’s overall risk management.","Organizations should describe how their processes for identifying, assessing, and managing climate-related risks are integrated into their overall risk management.",,,,
d81f28c8-fbeb-4de9-ba22-8b1e78c672e8,Transition,,,d9ddea06-96b2-4efb-b2d5-899230c5ee10,9ece8f3e-d669-4bd5-8214-98b3d092cb49,,,,,,,,,OSFI collects and structures data to help management identify and assess specific risks and TCFD is closely aligned with the description of management process to collect and structure,Partial,,
af4b9c05-2c87-48ca-a145-fe6ee4df4b10,Object,359560f8-36dd-4174-a248-c86d428a532f,Metrics and Targets,,,,,,,,,,,,,,
7fa7efbb-766e-49ec-8e1b-5a732304c5b6,Group,af4b9c05-2c87-48ca-a145-fe6ee4df4b10,Recommended Disclosure a),,,,,,,,Qualitative,Disclose the metrics used by the organization to assess climate-related risks and opportunities in line with its strategy and risk management process.,"Organizations should provide the key metrics used to measure and manage climate-related risks and opportunities, as described in Tables A1.1 and A1.2 (pp. 75–76), as well as metrics consistent with the cross-industry, climate-related metric categories described in Table A2.1 (p. 79). Organizations should consider including metrics on climate-related risks associated with water, energy, land use, and waste management where relevant and applicable. Where climate-related issues are material, organizations should consider describing whether and how related performance metrics are incorporated into remuneration policies. Where relevant, organizations should provide their internal carbon prices as well as climate-related opportunity metrics such as revenue from products and services designed for a low-carbon economy. Metrics should be provided for historical periods to allow for trend analysis. Where appropriate, organizations should consider providing forward-looking metrics for the cross-industry, climate-related metric categories described in Table A2.1 (p. 79), consistent with their business or strategic planning time horizons. In addition, where not apparent, organizations should provide a description of the methodologies used to calculate or estimate climate-related metrics.",,,,
b2114f9e-43a0-4411-bc5d-f084c71d0a54,Attribute,7fa7efbb-766e-49ec-8e1b-5a732304c5b6,Supplemental Guidance for Banks,,,,,,,,Qualitative,Supplemental Guidance for Banks,"Banks should provide the metrics used to assess the impact of (transition and physical) climate-related risks on their lending and other financial intermediary business activities in the short, medium, and long term. Metrics provided may relate to credit exposure, equity and debt holdings, or trading positions, broken down by: ‒ Industry ‒ Geography ‒ Credit quality (e.g., investment grade or non-investment grade, internal rating system) ‒ Average tenor. Banks should also provide the amount and percentage of carbon-related assets relative to total assets as well as the amount of lending and other financing connected with climate-related opportunities. Banks should describe the extent to which their lending and other financial intermediary business activities, where relevant, are aligned with a well below 2°C scenario, using whichever approach or metrics best suit their organizational context or capabilities. Banks should also indicate which financial intermediary business activities (e.g., loans to specific sectors or industries) are included.",,,,
642e9811-2685-470c-adbc-c1909777f5e8,Attribute,7fa7efbb-766e-49ec-8e1b-5a732304c5b6,Supplemental Guidance for Insurance Companies,,,,,,,,Qualitative,Supplemental Guidance for Insurance Companies,"Insurance companies should provide aggregated risk exposure to weather-related catastrophes of their property business (i.e., annual aggregated expected losses from weather-related catastrophes) by relevant jurisdiction. Insurance companies should describe the extent to which their insurance underwriting activities, where relevant, are aligned with a well below 2°C scenario, using whichever approach or metrics best suit their organizational context or capabilities. Insurance companies should also indicate which insurance underwriting activities (e.g., lines of business) are included.",,,,
8a65c790-bff9-497f-9d1d-da6096b24f98,Attribute,7fa7efbb-766e-49ec-8e1b-5a732304c5b6,Supplemental Guidance for Asset Owners,,,,,,,,Qualitative,Supplemental Guidance for Asset Owners,"Asset owners should describe metrics used to assess climate-related risks and opportunities in each fund or investment strategy. Where relevant, asset owners should also describe how these metrics have changed over time. Where appropriate, asset owners should provide metrics considered in investment decisions and monitoring. Asset owners should describe the extent to which assets they own and their funds and investment strategies, where relevant, are aligned with a well below 2°C scenario, using whichever approach or metrics best suit their organizational context or capabilities. Asset owners should also indicate which asset classes are included.",,,,
7298b7ce-65dc-4018-b24b-ed544fe0bd78,Attribute,7fa7efbb-766e-49ec-8e1b-5a732304c5b6,Supplemental Guidance for Asset Managers,,,,,,,,Qualitative,Supplemental Guidance for Asset Managers,"Asset managers should describe metrics used to assess climate-related risks and opportunities in each product or investment strategy. Where relevant, asset managers should also describe how these metrics have changed over time.Where appropriate, asset managers should provide metrics considered in investment decisions and monitoring. Asset managers should describe the extent to which their assets under management and products and investment strategies, where relevant, are aligned with a well below 2°C scenario, using whichever approach or metrics best suit their organizational context or capabilities. Asset managers should also indicate which asset classes are included.",,,,
