ID,TYPE,PARENT,NAME,SOURCE,TARGET,REFERENCE_MODEL_ID,TERM_ID,LABEL,,PROPERTIES:,level,Code,description
9835d2f3-bc83-4424-bf96-8e95f4823359,Attribute,457f5851-bd6a-4dfd-8a72-369ce8c9071e,Agricultural & Farm Machinery,,,,,,,,4,20106015,"Companies manufacturing agricultural machinery, farm machinery, and their related parts. Includes machinery used for the production of crops and agricultural livestock, agricultural tractors, planting and fertilizing machinery, fertilizer and chemical application equipment, and grain dryers and blowers."
dd8484c3-5b6b-43cf-af06-d9475492852c,Attribute,457f5851-bd6a-4dfd-8a72-369ce8c9071e,Industrial Machinery,,,,,,,,4,20106020,"Manufacturers of industrial machinery and industrial components. Includes companies that manufacture presses, machine tools, compressors, pollution control equipment, elevators, escalators, insulators, pumps, roller bearings and other metal fabrications."
cce77b54-cc54-4198-9550-afd7401f4dc4,Attribute,457f5851-bd6a-4dfd-8a72-369ce8c9071e,Trading Companies & Distributors,,,,,,,,3,201070,
180bcea2-5c74-4852-8caf-036bdd38202b,Attribute,457f5851-bd6a-4dfd-8a72-369ce8c9071e,Trading Companies & Distributors,,,,,,,,4,20107010,Trading companies and other distributors of industrial equipment and products.
6ace2fac-450e-4d30-a8ce-454f29bde007,Attribute,457f5851-bd6a-4dfd-8a72-369ce8c9071e,Commercial  & Professional Services,,,,,,,,2,2020,
7e06ac82-7ca7-4068-aebd-4f3daf1b5133,Attribute,457f5851-bd6a-4dfd-8a72-369ce8c9071e,Commercial Services & Supplies,,,,,,,,3,202010,
6ac2a157-10c3-4af9-919a-3f19c11e14a9,Attribute,457f5851-bd6a-4dfd-8a72-369ce8c9071e,Commercial Printing,,,,,,,,4,20201010,Companies providing commercial printing services. Includes printers primarily serving the media industry.
8e6c1cbf-e218-437e-8687-2b7d3430335c,Attribute,457f5851-bd6a-4dfd-8a72-369ce8c9071e,Environmental & Facilities Services,,,,,,,,4,20201050,"Companies providing environmental and facilities maintenance services. Includes waste management, facilities management and pollution control services.  Excludes large-scale water treatment systems classified in the Water Utilities Sub-Industry."
d6fd6b26-5341-447c-9a64-11f12103f560,Attribute,457f5851-bd6a-4dfd-8a72-369ce8c9071e,Office Services & Supplies,,,,,,,,4,20201060,Providers of office services and manufacturers of office supplies and equipment not classified elsewhere.
eb221697-3cf2-46cf-abce-96c84844bb48,Attribute,457f5851-bd6a-4dfd-8a72-369ce8c9071e,Diversified Support Services,,,,,,,,4,20201070,"Companies primarily providing labor oriented support services to businesses and governments.  Includes commercial cleaning services, dining & catering services, equipment repair services, industrial maintenance services, industrial auctioneers, storage & warehousing, transaction services, uniform rental services, and other business support services."
aee1cc3e-3391-4557-8728-dd98bf830643,Attribute,457f5851-bd6a-4dfd-8a72-369ce8c9071e,Security & Alarm Services,,,,,,,,4,20201080,"Companies providing security and protection services to business and governments. Includes companies providing services such as correctional facilities, security & alarm services, armored transportation & guarding.  Excludes companies providing security software classified under the Systems Software Sub-Industry and home security services classified under the Specialized Consumer Services Sub-Industry. Also excludes companies manufacturing security system equipment classified under the Electronic Equipment & Instruments Sub-Industry."
5e1d45c9-6496-4276-bd39-4b22dd6b1a08,Attribute,457f5851-bd6a-4dfd-8a72-369ce8c9071e,Professional Services,,,,,,,,3,202020,
7c3ba6b9-c132-4e52-9382-385eede58bf4,Attribute,457f5851-bd6a-4dfd-8a72-369ce8c9071e,Human Resource & Employment Services,,,,,,,,4,20202010,"Companies providing business support services relating to human capital management. Includes employment agencies, employee training, payroll & benefit support services, retirement support services and temporary agencies."
c58ad212-9969-4148-9d93-8e255d49f8c1,Attribute,457f5851-bd6a-4dfd-8a72-369ce8c9071e,Research & Consulting Services,,,,,,,,4,20202020,"Companies primarily providing research and consulting services to businesses and governments not classified elsewhere.  Includes companies involved in management consulting services, architectural design, business information or scientific research, marketing, and testing & certification services. Excludes companies providing information technology consulting services classified in the IT Consulting & Other Services Sub-Industry."
807ef441-e1ea-4e19-a78e-c5322fba1b4d,Attribute,457f5851-bd6a-4dfd-8a72-369ce8c9071e,Transportation,,,,,,,,2,2030,
4ad8ad2a-43ce-4e68-9671-7504408aa1b3,Attribute,457f5851-bd6a-4dfd-8a72-369ce8c9071e,Air Freight & Logistics,,,,,,,,3,203010,
69765827-1ed3-4672-97a1-1e07847523c1,Attribute,457f5851-bd6a-4dfd-8a72-369ce8c9071e,Air Freight & Logistics,,,,,,,,4,20301010,"Companies providing air freight transportation, courier and logistics services, including package and mail delivery and customs agents. Excludes those companies classified in the Airlines, Marine or Trucking Sub-Industries."
df7fd36a-dbdf-4f0c-b99b-7695fe761ae6,Attribute,457f5851-bd6a-4dfd-8a72-369ce8c9071e,Airlines,,,,,,,,3,203020,
425e7643-4d92-4c8c-a477-ebbdabb45074,Attribute,457f5851-bd6a-4dfd-8a72-369ce8c9071e,Airlines,,,,,,,,4,20302010,Companies providing primarily passenger air transportation.
d5023b85-3901-46df-8d63-837a02a04d33,Attribute,457f5851-bd6a-4dfd-8a72-369ce8c9071e,Marine,,,,,,,,3,203030,
eee96328-ebb4-4ea7-bdd8-4b507a1091c3,Attribute,457f5851-bd6a-4dfd-8a72-369ce8c9071e,Marine,,,,,,,,4,20303010,"Companies providing goods or passenger maritime transportation. Excludes cruise-ships classified in the Hotels, Resorts & Cruise Lines Sub-Industry."
a05573f4-6eb1-4ca5-9d7b-a67a6b0da9f9,Attribute,457f5851-bd6a-4dfd-8a72-369ce8c9071e,Road & Rail,,,,,,,,3,203040,
96785a65-5d4e-4239-9e25-2699493cd063,Attribute,457f5851-bd6a-4dfd-8a72-369ce8c9071e,Railroads,,,,,,,,4,20304010,Companies providing primarily goods and passenger rail  transportation.
5018a1c9-00d1-47a9-a916-e692de6c82b2,Attribute,457f5851-bd6a-4dfd-8a72-369ce8c9071e,Trucking,,,,,,,,4,20304020,Companies providing primarily goods and passenger land transportation. Includes vehicle rental and taxi companies.
e8d45716-6835-4a46-a906-74cee693541e,Attribute,457f5851-bd6a-4dfd-8a72-369ce8c9071e,Transportation Infrastructure,,,,,,,,3,203050,
77e6c272-a9c1-4975-acfc-589456a54925,Attribute,457f5851-bd6a-4dfd-8a72-369ce8c9071e,Airport Services,,,,,,,,4,20305010,Operators of airports and companies providing related services.
e2e9ef33-0afa-4748-97e6-ba3f9af944ae,Attribute,457f5851-bd6a-4dfd-8a72-369ce8c9071e,Highways & Railtracks,,,,,,,,4,20305020,"Owners and operators of roads, tunnels and railtracks."
c1a417c0-6c5f-4a7c-aa50-81c5d0147651,Attribute,457f5851-bd6a-4dfd-8a72-369ce8c9071e,Marine Ports & Services,,,,,,,,4,20305030,Owners and operators of marine ports and related services.
a201a75e-850d-45f4-9331-f10f30db62a9,Object,be568504-8955-42fd-8e61-699fc2e0ea80,Consumer Discretionary,,,,,,,,1,25,
81f6b02c-9a64-4da3-b183-7e2af563e017,Attribute,a201a75e-850d-45f4-9331-f10f30db62a9,Automobiles & Components,,,,,,,,2,2510,
c1263225-0d71-4e39-a0f0-cc808f5a58f2,Attribute,a201a75e-850d-45f4-9331-f10f30db62a9,Auto Components,,,,,,,,3,251010,
02d2f69a-4be7-4463-8c72-2af950ce1633,Attribute,a201a75e-850d-45f4-9331-f10f30db62a9,Auto Parts & Equipment,,,,,,,,4,25101010,Manufacturers of parts and accessories for  automobiles and motorcycles. Excludes companies classified in the Tires & Rubber Sub-Industry.
2847eb8e-0eb5-4e5c-8d0a-d044fcf009d9,Attribute,a201a75e-850d-45f4-9331-f10f30db62a9,Tires & Rubber,,,,,,,,4,25101020,Manufacturers of tires and rubber.
42886b3c-3ce9-42c0-920e-18d3f31ac593,Attribute,a201a75e-850d-45f4-9331-f10f30db62a9,Automobiles,,,,,,,,3,251020,
ef318aba-4314-4efe-8464-9285597ec219,Attribute,a201a75e-850d-45f4-9331-f10f30db62a9,Automobile Manufacturers,,,,,,,,4,25102010,Companies that produce mainly passenger automobiles and light trucks. Excludes companies producing mainly motorcycles and three-wheelers classified in the Motorcycle Manufacturers Sub-Industry and heavy duty trucks classified in the Construction Machinery & Heavy Trucks Sub-Industry.
833ca980-1fc7-4881-a6df-1c2db0a55c72,Attribute,a201a75e-850d-45f4-9331-f10f30db62a9,Motorcycle Manufacturers,,,,,,,,4,25102020,"Companies that produce motorcycles, scooters or three-wheelers. Excludes bicycles classified in the Leisure Products Sub-Industry."
c9173c5e-877a-4b1e-9921-9bb63f282f8c,Attribute,a201a75e-850d-45f4-9331-f10f30db62a9,Consumer Durables & Apparel,,,,,,,,2,2520,
ad2bcc80-959e-4b84-908d-afe328897edb,Attribute,a201a75e-850d-45f4-9331-f10f30db62a9,Household Durables,,,,,,,,3,252010,
583cbee2-a0f5-47e9-827a-5c1dea8deeef,Attribute,a201a75e-850d-45f4-9331-f10f30db62a9,Consumer Electronics,,,,,,,,4,25201010,"Manufacturers of consumer electronics products including TVs, home audio equipment, game consoles, digital cameras, and related products. Excludes personal home computer manufacturers classified in the Technology Hardware, Storage & Peripherals Sub-Industry, and electric household appliances classified in the Household Appliances Sub-Industry."
13733d22-9ffe-45e0-bbd5-027a9fa8e567,Attribute,a201a75e-850d-45f4-9331-f10f30db62a9,Home Furnishings,,,,,,,,4,25201020,"Manufacturers of soft home furnishings or furniture, including upholstery, carpets and wall-coverings."
be73e0eb-6fbc-457e-88cb-360074c04836,Attribute,a201a75e-850d-45f4-9331-f10f30db62a9,Homebuilding,,,,,,,,4,25201030,Residential construction companies. Includes manufacturers of prefabricated houses and semi-fixed manufactured homes.
35d8e255-0914-49c8-ac51-c56498920825,Attribute,a201a75e-850d-45f4-9331-f10f30db62a9,Household Appliances,,,,,,,,4,25201040,"Manufacturers of electric household appliances and related products.  Includes manufacturers of power and hand tools, including garden improvement tools.  Excludes TVs and other audio and video products classified in the Consumer Electronics Sub-Industry and personal computers classified in the Technology Hardware, Storage & Peripherals Sub-Industry."
724ae515-3291-4cec-98b2-dd5ee6b2b9ac,Attribute,a201a75e-850d-45f4-9331-f10f30db62a9,Housewares & Specialties,,,,,,,,4,25201050,"Manufacturers of durable household products, including cutlery, cookware, glassware, crystal, silverware, utensils, kitchenware and consumer specialties not classified elsewhere."
6e45f15a-6080-47c6-8e9e-a94daf881d89,Attribute,a201a75e-850d-45f4-9331-f10f30db62a9,Leisure Products,,,,,,,,3,252020,
28ab6d09-f78c-4689-8f5d-f518f40c0183,Attribute,a201a75e-850d-45f4-9331-f10f30db62a9,Leisure Products,,,,,,,,4,25202010,"Manufacturers of leisure products and equipment including sports equipment, bicycles and toys."
a0eb3765-f9c3-4be1-bae4-3de7e66b5ffe,Attribute,a201a75e-850d-45f4-9331-f10f30db62a9,"Textiles, Apparel & Luxury Goods",,,,,,,,3,252030,
9f0390c2-06ab-42b9-a0e4-4c2eb5e3acd2,Attribute,a201a75e-850d-45f4-9331-f10f30db62a9,"Apparel, Accessories & Luxury Goods",,,,,,,,4,25203010,"Manufacturers of apparel, accessories & luxury goods. Includes companies primarily producing designer handbags, wallets, luggage, jewelry and watches. Excludes shoes classified in the Footwear Sub-Industry."
05ed3274-9765-43ca-9fae-32f7c0ed69a7,Attribute,a201a75e-850d-45f4-9331-f10f30db62a9,Footwear,,,,,,,,4,25203020,Manufacturers of footwear. Includes sport and leather shoes.
3da016b7-8d7f-4a81-aba2-189746b3d5b7,Attribute,a201a75e-850d-45f4-9331-f10f30db62a9,Textiles,,,,,,,,4,25203030,"Manufacturers of textile and related products not classified in the Apparel, Accessories & Luxury Goods, Footwear or Home Furnishings Sub-Industries."
66df8c5d-1e9b-466e-8e0c-33fb7d82ee46,Attribute,a201a75e-850d-45f4-9331-f10f30db62a9,Consumer Services,,,,,,,,2,2530,
cd1227fa-878d-4e49-8a7d-de5255b021d3,Attribute,a201a75e-850d-45f4-9331-f10f30db62a9,"Hotels, Restaurants & Leisure",,,,,,,,3,253010,
fc06ba77-8d05-4968-a324-7e4cea486946,Attribute,a201a75e-850d-45f4-9331-f10f30db62a9,Casinos & Gaming,,,,,,,,4,25301010,Owners and operators of casinos and gaming facilities. Includes companies providing lottery and betting services.
c535f391-1138-4169-8673-fe75a882afb4,Attribute,a201a75e-850d-45f4-9331-f10f30db62a9,"Hotels, Resorts & Cruise Lines",,,,,,,,4,25301020,"Owners and operators of hotels, resorts and cruise-ships. Includes travel agencies, tour operators and related services not classified elsewhere . Excludes casino-hotels classified in the Casinos & Gaming Sub-Industry."
42188d4f-5f79-4ba3-ac4d-c495a355a003,Attribute,a201a75e-850d-45f4-9331-f10f30db62a9,Leisure Facilities,,,,,,,,4,25301030,"Owners and operators of leisure facilities, including sport and fitness centers, stadiums, golf courses and amusement parks not classified in the Movies & Entertainment Sub-Industry."
da711715-d1cb-4871-a4b2-f1efc765fdfc,Attribute,a201a75e-850d-45f4-9331-f10f30db62a9,Restaurants,,,,,,,,4,25301040,"Owners and operators of restaurants, bars, pubs, fast-food or take-out facilities. Includes companies that provide food catering services."
bb10598b-ae9a-4beb-b6e3-40b93107b75b,Attribute,a201a75e-850d-45f4-9331-f10f30db62a9,Diversified Consumer Services,,,,,,,,3,253020,
a4f02dbf-9c2d-43de-b9ea-9a114480b228,Attribute,a201a75e-850d-45f4-9331-f10f30db62a9,Education Services,,,,,,,,4,25302010,"Companies providing educational services, either on-line or through conventional teaching methods. Includes, private universities, correspondence teaching, providers of educational seminars, educational materials and technical education. Excludes companies providing employee education programs classified in the Human Resources & Employment Services Sub-Industry"
eede2f6c-aecd-48cf-8e35-67e9334102db,Attribute,a201a75e-850d-45f4-9331-f10f30db62a9,Specialized Consumer Services,,,,,,,,4,25302020,"Companies providing consumer services not classified elsewhere.  Includes residential services, home security, legal services, personal services, renovation & interior design services, consumer auctions and wedding & funeral services."
b55a8b95-58e2-4693-ab09-12f4de780c0b,Attribute,a201a75e-850d-45f4-9331-f10f30db62a9,Retailing,,,,,,,,2,2550,
04c498ee-9d33-4041-849c-b6733c210788,Attribute,a201a75e-850d-45f4-9331-f10f30db62a9,Distributors,,,,,,,,3,255010,
9b6e110e-8af2-40ec-b85c-03c7b00a66cd,Attribute,a201a75e-850d-45f4-9331-f10f30db62a9,Distributors,,,,,,,,4,25501010,Distributors and wholesalers of general merchandise not classified elsewhere. Includes vehicle distributors.
97b99861-4c77-4f3b-9e32-209db176a9d4,Attribute,a201a75e-850d-45f4-9331-f10f30db62a9,Internet & Direct Marketing Retail,,,,,,,,3,255020,
be3813ce-142d-4eb5-9f6a-d828533d1e3f,Attribute,a201a75e-850d-45f4-9331-f10f30db62a9,Internet & Direct Marketing Retail,,,,,,,,4,25502020,"Companies  providing  retail  services  primarily  on  the Internet, through mail order, and TV home shopping retailers. Also includes companies providing online marketplaces for consumer products and services."
d74e0748-7aa4-4b0d-b98b-a7da5cec9a5d,Attribute,a201a75e-850d-45f4-9331-f10f30db62a9,Multiline Retail,,,,,,,,3,255030,
74ba3722-a9c6-4cd0-9987-dce87ed8ba89,Attribute,a201a75e-850d-45f4-9331-f10f30db62a9,Department Stores,,,,,,,,4,25503010,Owners and operators of department stores.
f8ade362-d993-4301-bf3a-de2dc2661b19,Attribute,a201a75e-850d-45f4-9331-f10f30db62a9,General Merchandise Stores,,,,,,,,4,25503020,Owners and operators of stores offering diversified general merchandise. Excludes hypermarkets and large-scale super centers classified in the Hypermarkets & Super Centers Sub-Industry.
1168654c-7a4f-4daf-b1ee-f25009d2976a,Attribute,a201a75e-850d-45f4-9331-f10f30db62a9,Specialty Retail,,,,,,,,3,255040,
5d962691-6505-4150-9b3a-3fd3b21c7836,Attribute,a201a75e-850d-45f4-9331-f10f30db62a9,Apparel Retail,,,,,,,,4,25504010,Retailers specialized mainly in apparel and accessories.
5f95822f-8c06-4b95-b8f9-62888db0cb9f,Attribute,a201a75e-850d-45f4-9331-f10f30db62a9,Computer & Electronics Retail,,,,,,,,4,25504020,"Owners and operators of consumer electronics, computers, video and related products retail stores."
2d594bab-9b15-4114-85e0-f0591e0551ea,Attribute,a201a75e-850d-45f4-9331-f10f30db62a9,Home Improvement Retail,,,,,,,,4,25504030,Owners and operators of home and garden improvement retail stores. Includes stores offering building materials and supplies.
a8be5b32-d39b-45ab-97c1-0db032ece771,Attribute,a201a75e-850d-45f4-9331-f10f30db62a9,Specialty Stores,,,,,,,,4,25504040,"Owners and operators of specialty retail stores not classified elsewhere. Includes jewelry stores, toy stores, office supply stores, health & vision care stores, and book & entertainment stores."
5d356253-b008-4da8-b572-7fc9d361f731,Attribute,a201a75e-850d-45f4-9331-f10f30db62a9,Automotive Retail,,,,,,,,4,25504050,"Owners and operators of stores specializing in automotive retail.  Includes auto dealers, gas stations, and retailers of auto accessories, motorcycles & parts, automotive glass, and automotive equipment & parts."
a7103d75-da04-4f10-97d7-dc91e83b61d9,Attribute,a201a75e-850d-45f4-9331-f10f30db62a9,Homefurnishing Retail,,,,,,,,4,25504060,"Owners and operators of furniture and home furnishings retail stores.  Includes residential furniture, homefurnishings, housewares, and interior design.  Excludes home and garden improvement stores, classified in the Home Improvement Retail Sub-Industry."
961a2b65-b9ac-46ca-9f82-129d619e1f4e,Object,be568504-8955-42fd-8e61-699fc2e0ea80,Consumer Staples,,,,,,,,1,30,
6aa42993-7ef5-4862-bd94-560e9e4a6c42,Attribute,961a2b65-b9ac-46ca-9f82-129d619e1f4e,Food & Staples Retailing,,,,,,,,2,3010,
0a95ee2b-637b-4044-9671-2a02e91314ca,Attribute,961a2b65-b9ac-46ca-9f82-129d619e1f4e,Food & Staples Retailing,,,,,,,,3,301010,
9c4b5c42-33d4-45d9-84f5-6d652d8e3281,Attribute,961a2b65-b9ac-46ca-9f82-129d619e1f4e,Drug Retail,,,,,,,,4,30101010,Owners and operators of primarily drug retail stores and pharmacies.
87549527-4033-423e-943f-b096f5dcc5bb,Attribute,961a2b65-b9ac-46ca-9f82-129d619e1f4e,Food Distributors,,,,,,,,4,30101020,Distributors of food products to other companies and not directly to the consumer.
76ddb68b-e493-4cd5-a437-8f3e86c6c611,Attribute,961a2b65-b9ac-46ca-9f82-129d619e1f4e,Food Retail,,,,,,,,4,30101030,Owners and operators of primarily food retail stores.
7d3c7e05-2867-419a-9ee3-4015d7f656d7,Attribute,961a2b65-b9ac-46ca-9f82-129d619e1f4e,Hypermarkets & Super Centers,,,,,,,,4,30101040,"Owners and operators of hypermarkets and super centers selling food and a wide-range of consumer staple products.  Excludes Food and Drug Retailers classified in the Food Retail and Drug Retail Sub-Industries, respectively."
2729d29e-38bf-4e95-9600-5652521653d1,Attribute,961a2b65-b9ac-46ca-9f82-129d619e1f4e,"Food, Beverage & Tobacco",,,,,,,,2,3020,
35ac5689-063f-446c-8b5b-0ce616b84445,Attribute,961a2b65-b9ac-46ca-9f82-129d619e1f4e,Beverages,,,,,,,,3,302010,
a954345b-befc-4211-ab0d-49926ab676d8,Attribute,961a2b65-b9ac-46ca-9f82-129d619e1f4e,Brewers,,,,,,,,4,30201010,Producers of beer and malt liquors. Includes breweries not classified in the Restaurants Sub-Industry.
146101b6-3c39-4de8-83cd-6a140eee571e,Attribute,961a2b65-b9ac-46ca-9f82-129d619e1f4e,Distillers & Vintners,,,,,,,,4,30201020,"Distillers, vintners and producers of alcoholic beverages not classified in the Brewers Sub-Industry."
31d4e5cc-f6dc-4ff9-bb6b-76ff70ee220d,Attribute,961a2b65-b9ac-46ca-9f82-129d619e1f4e,Soft Drinks,,,,,,,,4,30201030,Producers of non-alcoholic beverages including mineral waters. Excludes producers of milk classified in the Packaged Foods Sub-Industry.
959395c3-b2e5-449f-8451-f9ab2336ebd2,Attribute,961a2b65-b9ac-46ca-9f82-129d619e1f4e,Food Products,,,,,,,,3,302020,
36edb262-820f-4575-b206-1aff90e77897,Attribute,961a2b65-b9ac-46ca-9f82-129d619e1f4e,Agricultural Products,,,,,,,,4,30202010,"Producers of agricultural products. Includes crop growers, owners of plantations and companies that produce and process foods but do not package and market them. Excludes companies classified in the Forest Products Sub-Industry and those that package and market the food products classified in the Packaged Foods Sub-Industry."
ee3aee71-31b1-4f23-b230-fa80390de3f5,Attribute,961a2b65-b9ac-46ca-9f82-129d619e1f4e,Packaged Foods & Meats,,,,,,,,4,30202030,"Producers of packaged foods including dairy products, fruit juices, meats, poultry, fish and pet foods."
41e6dfe0-72a7-4b6e-943b-d382e1570135,Attribute,961a2b65-b9ac-46ca-9f82-129d619e1f4e,Tobacco,,,,,,,,3,302030,
53c4c381-f5c3-4092-a584-082b530d4c74,Attribute,961a2b65-b9ac-46ca-9f82-129d619e1f4e,Tobacco,,,,,,,,4,30203010,Manufacturers of cigarettes and other tobacco products.
70574e0b-0304-41a5-919b-1c09cbf06f96,Attribute,961a2b65-b9ac-46ca-9f82-129d619e1f4e,Household & Personal Products,,,,,,,,2,3030,
19f7b6bd-4494-4ffa-99ab-36cfed6efdd2,Attribute,961a2b65-b9ac-46ca-9f82-129d619e1f4e,Household Products,,,,,,,,3,303010,
92d6c177-db5f-4551-ae4e-b9dae8b837f9,Attribute,961a2b65-b9ac-46ca-9f82-129d619e1f4e,Household Products,,,,,,,,4,30301010,"Producers of non-durable household products, including detergents, soaps, diapers and other tissue and household paper products not classified in the Paper Products Sub-Industry."
a46d3b27-ca49-48bf-9a3d-3f5351eafd78,Attribute,961a2b65-b9ac-46ca-9f82-129d619e1f4e,Personal Products,,,,,,,,3,303020,
d6ecad86-f8b4-4fca-840c-9b610797ac8e,Attribute,961a2b65-b9ac-46ca-9f82-129d619e1f4e,Personal Products,,,,,,,,4,30302010,"Manufacturers of personal and beauty care products, including cosmetics and perfumes."
220f5bc2-68ed-4cfd-9ad8-71bde5e16df2,Object,be568504-8955-42fd-8e61-699fc2e0ea80,Health Care,,,,,,,,1,35,
65eef8ea-c5e0-4877-942c-2ed637248623,Attribute,220f5bc2-68ed-4cfd-9ad8-71bde5e16df2,Health Care Equipment & Services,,,,,,,,2,3510,
5f96b1fe-e5a0-49a7-be33-d8d95af3ccc6,Attribute,220f5bc2-68ed-4cfd-9ad8-71bde5e16df2,Health Care Equipment & Supplies,,,,,,,,3,351010,
f720921e-36c7-4ad8-8a60-ee5b520f584b,Attribute,220f5bc2-68ed-4cfd-9ad8-71bde5e16df2,Health Care Equipment,,,,,,,,4,35101010,"Manufacturers of health care equipment and devices. Includes medical instruments, drug delivery systems, cardiovascular & orthopedic devices, and diagnostic equipment."
d3ae037a-8989-4c00-92eb-8613888dd724,Attribute,220f5bc2-68ed-4cfd-9ad8-71bde5e16df2,Health Care Supplies,,,,,,,,4,35101020,"Manufacturers of health care supplies and medical products not classified elsewhere. Includes eye care products, hospital supplies, and safety needle & syringe devices."
3704c014-fc8a-485c-8547-9994bc622f37,Attribute,220f5bc2-68ed-4cfd-9ad8-71bde5e16df2,Health Care Providers & Services,,,,,,,,3,351020,
6f784603-4b46-4b4b-9ead-a2314b6e10d7,Attribute,220f5bc2-68ed-4cfd-9ad8-71bde5e16df2,Health Care Distributors,,,,,,,,4,35102010,Distributors and wholesalers of health care products not classified elsewhere.
e170bc1c-4fd9-40c3-9133-20386d287bab,Attribute,220f5bc2-68ed-4cfd-9ad8-71bde5e16df2,Health Care  Services,,,,,,,,4,35102015,"Providers of patient health care services not classified elsewhere. Includes dialysis centers, lab testing services, and pharmacy management services. Also includes companies providing business support services to health care providers, such as clerical support services, collection agency services, staffing services and outsourced sales & marketing services"
1fb1f650-1cea-4d34-9792-c434e48b4a6c,Attribute,220f5bc2-68ed-4cfd-9ad8-71bde5e16df2,Health Care Facilities,,,,,,,,4,35102020,"Owners and operators of health care facilities, including hospitals, nursing homes, rehabilitation centers and animal hospitals."
e0946aaa-5b1e-42fa-afdb-543d45751660,Attribute,220f5bc2-68ed-4cfd-9ad8-71bde5e16df2,Managed Health Care,,,,,,,,4,35102030,Owners and operators of Health Maintenance Organizations (HMOs) and other managed plans.
7579fdc8-928a-4eba-ace4-9c8b68ed2665,Attribute,220f5bc2-68ed-4cfd-9ad8-71bde5e16df2,Health Care Technology,,,,,,,,3,351030,
afbaa6d0-9d02-466b-b85c-e02e684671fe,Attribute,220f5bc2-68ed-4cfd-9ad8-71bde5e16df2,Health Care Technology,,,,,,,,4,35103010,"Companies providing information technology services primarily to health care providers.  Includes companies providing application, systems and/or data processing software, internet-based tools, and IT consulting services to doctors, hospitals or businesses operating primarily in the Health Care Sector"
cef56a3e-8c00-4ab3-9afc-5825ef746c8c,Attribute,220f5bc2-68ed-4cfd-9ad8-71bde5e16df2,"Pharmaceuticals, Biotechnology & Life Sciences",,,,,,,,2,3520,
de4df1bb-4ce3-4080-8f04-d331e845da5e,Attribute,220f5bc2-68ed-4cfd-9ad8-71bde5e16df2,Biotechnology,,,,,,,,3,352010,
1ab039a1-63c0-4432-a15d-d93a31ed7c6a,Attribute,220f5bc2-68ed-4cfd-9ad8-71bde5e16df2,Biotechnology,,,,,,,,4,35201010,"Companies primarily engaged in the research, development, manufacturing and/or marketing of products based on genetic analysis and genetic engineering.  Includes companies specializing in protein-based therapeutics to treat human diseases. Excludes companies manufacturing products using biotechnology but without a health care application."
80ad2fc8-476c-45bf-800d-a9b669243ecc,Attribute,220f5bc2-68ed-4cfd-9ad8-71bde5e16df2,Pharmaceuticals,,,,,,,,3,352020,
23a2ce69-6bd4-4f90-bda2-bb00c426665b,Attribute,220f5bc2-68ed-4cfd-9ad8-71bde5e16df2,Pharmaceuticals,,,,,,,,4,35202010,"Companies engaged in the research, development or production of pharmaceuticals. Includes veterinary drugs."
e76d96b7-4043-465a-959c-1bf46f2c6168,Attribute,220f5bc2-68ed-4cfd-9ad8-71bde5e16df2,Life Sciences Tools & Services,,,,,,,,3,352030,
