ID,TYPE,PARENT,NAME,SOURCE,TARGET,REFERENCE_MODEL_ID,TERM_ID,LABEL,,PROPERTIES:,Description
8ecee9a7-dff3-4051-a4a4-606925b5d79f,Attribute,3ae8e193-4a9d-4810-86dd-7d585f9c623e,Requirement  to 2-24-a(iv),,,,,,,,training that the organization provides on implementing the commitments.
9598a723-f93a-4b8e-94aa-457b082a3c97,Object,a1693f3b-4a23-43fa-a532-055c4625f0d9,Disclosure 2-25 Processes to remediate negative impacts,,,,,,,,
b00b5791-2897-4bec-8763-ebbe0f2d4727,Attribute,9598a723-f93a-4b8e-94aa-457b082a3c97,Requirement  to 2-25-a,,,,,,,,"describe how the organization tracks the effectiveness of the grievance mechanisms and other remediation processes, and report examples of their effectiveness, including stakeholder feedback."
ef8e3714-9a52-4240-aac4-1702ad0a0eb7,Attribute,9598a723-f93a-4b8e-94aa-457b082a3c97,Requirement  to 2-25-b,,,,,,,,"describe its approach to identify and address grievances, including the grievance mechanisms that the organization has established or participates in;"
54a59a80-5e84-48f5-abb7-caf7e738b500,Attribute,9598a723-f93a-4b8e-94aa-457b082a3c97,Requirement  to 2-25-c,,,,,,,,describe other processes by which the organization provides for or cooperates in the remediation of negative impacts that it identifies it has caused or contributed to;
e630e1dd-c552-4cb1-b5cf-cad6893fe0e5,Object,a1693f3b-4a23-43fa-a532-055c4625f0d9,Disclosure 2-26 Mechanisms for seeking advice and raising concerns,,,,,,,,
c4e84058-24a7-4913-8b01-0be095832e68,Attribute,e630e1dd-c552-4cb1-b5cf-cad6893fe0e5,Requirement  to 2-26-a(i),,,,,,,,seek advice on implementing the organization’s policies and practices for responsible business conduct
a182df5c-eb4f-46b7-8c72-c4edbe620817,Attribute,e630e1dd-c552-4cb1-b5cf-cad6893fe0e5,Requirement  to 2-26-a(ii),,,,,,,,raise concerns about the organization’s business conduct
7bb1611a-eb38-47db-83f3-a0c0c5858d76,Object,a1693f3b-4a23-43fa-a532-055c4625f0d9,Disclosure 2-27 Compliance with laws and regulations,,,,,,,,
f2dd4dd7-fcf0-4ca3-a8fd-bb22eed8c167,Attribute,7bb1611a-eb38-47db-83f3-a0c0c5858d76,Requirement  to 2-27-a(i),,,,,,,,instances for which fines were incurred;
35c99010-501f-45a4-938c-f99f4c3e463d,Attribute,7bb1611a-eb38-47db-83f3-a0c0c5858d76,Requirement  to 2-27-a(ii),,,,,,,,instances for which non-monetary sanctions were incurred;
7ce3824a-608f-4fec-8f3d-0bef7a99bc56,Attribute,7bb1611a-eb38-47db-83f3-a0c0c5858d76,Requirement  to 2-27-b(i),,,,,,,,fines for instances of non-compliance with laws and regulations that occurred in the current reporting period;
67d167b4-519e-4f3b-a997-ce6988b32c4a,Attribute,7bb1611a-eb38-47db-83f3-a0c0c5858d76,Requirement  to 2-27-b(ii),,,,,,,,fines for instances of non-compliance with laws and regulations that occurred in previous reporting periods;
6366caf3-65f6-41b3-b63f-8eeb70d73d7f,Attribute,7bb1611a-eb38-47db-83f3-a0c0c5858d76,Requirement  to 2-27-c,,,,,,,,describe the significant instances of non-compliance;
2b4f11b5-7807-4a29-a3b4-8770e3e9639a,Attribute,7bb1611a-eb38-47db-83f3-a0c0c5858d76,Requirement  to 2-27-d,,,,,,,,describe how it has determined significant instances of non-compliance.
53b605b3-df92-45be-a3bb-14ca01ca0fe4,Object,a1693f3b-4a23-43fa-a532-055c4625f0d9,Disclosure 2-28 Membership associations,,,,,,,,
6be4fd23-ae04-41b8-b0b1-3eb9472d66dd,Attribute,53b605b3-df92-45be-a3bb-14ca01ca0fe4,Requirement  to 2-28-a,,,,,,,,"report industry associations, other membership associations, and national or international advocacy organizations in which it participates in a significant role."
d1d8ee4d-4b2f-458c-87e8-2bc33b5a7df8,Object,a1693f3b-4a23-43fa-a532-055c4625f0d9,Disclosure 2-29 Approach to stakeholder engagement,,,,,,,,
f22c2d1a-fdce-4df0-9b1d-a29e303859c6,Attribute,d1d8ee4d-4b2f-458c-87e8-2bc33b5a7df8,Requirement  to 2-29-a(i),,,,,,,,"the categories of stakeholders it engages with, and how they are identified;"
f42ca7f8-d28a-46f0-aefd-e38212715662,Attribute,d1d8ee4d-4b2f-458c-87e8-2bc33b5a7df8,Requirement  to 2-29-a(ii),,,,,,,,the purpose of the stakeholder engagement
0f763a0d-e5fe-4e56-a703-937286b48e72,Attribute,d1d8ee4d-4b2f-458c-87e8-2bc33b5a7df8,Requirement  to 2-29-a(iii),,,,,,,,how the organization seeks to ensure meaningful engagement with stakeholders.
adf76bbf-b200-4873-b31d-979cebca4026,Object,a1693f3b-4a23-43fa-a532-055c4625f0d9,Disclosure 2-30 Collective bargaining agreements,,,,,,,,
f21ef6cf-d0fb-4889-be52-b3b91b61e879,Attribute,adf76bbf-b200-4873-b31d-979cebca4026,Requirement  to 2-30-a,,,,,,,,"for employees not covered by collective bargaining agreements, report whether the organization determines their working conditions and terms of employment based on collective bargaining agreements that cover its other employees or based on collective bargaining agreements from other organizations."